<?xml version="1.0" encoding="UTF-8"?>
<!--
Click nbfs://nbhost/SystemFileSystem/Templates/Licenses/license-default.txt to change this license
Click nbfs://nbhost/SystemFileSystem/Templates/XML/XMLDocument.xml to edit this template
-->



<school xmlns:xsi="http://www.w3.org/2001/XMLSchema-instance"
        xsi:noNamespaceSchemaLocation="student_unique.xsd">
  <student>
    <id>SV01</id>
    <name>Nguyễn Thị Thanh Thúy</name>
    <date>1997-12-20</date>
  </student>
  <student>
    <id>SV02</id>
    <name>Lê Thị Hồng Cẩm</name>
    <date>1998-01-21</date>
  </student>
  <student>
    <id>SV03</id>
    <name>Lê Thị Hồng Cẩm</name>
    <date>1997-11-11</date>
  </student>

  <enrollment studentRef="SV01" course="Toan101"/>
  <enrollment studentRef="SV02" course="Vatly203"/>
  <enrollment studentRef="SV03" course="Hoa305"/>
</school>
